{
  "$schema": "https://rmside.invalid/schemas/standard-includes/v1",
  "build": "101.103.57257",
  "compatibility": {
    "maximumMajor": 1,
    "minimumMajor": 1
  },
  "reservedFileNames": [
    "aquatic_freshwater.inc",
    "aquatic_saltwater.inc",
    "birds.inc",
    "br_conditions.inc",
    "capture_relic.inc",
    "cliffs.inc",
    "coastal_blending.inc",
    "colour.inc",
    "constants.inc",
    "decay.inc",
    "empire_buildings.inc",
    "empire_food.inc",
    "empire_gold.inc",
    "empire_wars.inc",
    "empire_wood.inc",
    "enlargemap.inc",
    "escalation_mode.inc",
    "externalterrainpatch.inc",
    "f_animals.inc",
    "f_colorcorrection.inc",
    "f_distances_a.inc",
    "f_distances_b.inc",
    "f_distances_b2.inc",
    "f_distances_c23.inc",
    "f_distances_c30.inc",
    "f_distances_d23.inc",
    "f_distances_d30.inc",
    "f_distances_e23.inc",
    "f_fargoldstone.inc",
    "f_kericek.inc",
    "f_neargoldstone.inc",
    "f_relics.inc",
    "f_resbymap.inc",
    "f_seasons.inc",
    "f_startingvills.inc",
    "f_watermasking.inc",
    "forest.inc",
    "furbearers.inc",
    "gaia_civilisation.inc",
    "generatingelevation.inc",
    "generatingobjects.inc",
    "helpers.inc",
    "herdable.inc",
    "herdable_starting.inc",
    "huntable.inc",
    "islands.inc",
    "land_and_water_resources.inc",
    "land_resources.inc",
    "lureable.inc",
    "mainland.inc",
    "market_lands.inc",
    "market_objects.inc",
    "market_terrain.inc",
    "neritic.inc",
    "object_groups.inc",
    "object_setup.inc",
    "oysters.inc",
    "predators.inc",
    "preliminaries.inc",
    "random_map.def",
    "reeds.inc",
    "regicide.inc",
    "relics.inc",
    "remote_resources.inc",
    "riparian.inc",
    "scaling.inc",
    "scouts.inc",
    "starting_objects.inc",
    "starting_resources.inc",
    "std_resources.inc",
    "stragglers.inc",
    "stragglers_coastal.inc",
    "stragglers_neutral.inc",
    "thebr_setup.inc",
    "themes.inc",
    "town_centres.inc",
    "town_herdable.inc",
    "villagers.inc",
    "walls.inc",
    "water_blending.inc",
    "water_preset.inc",
    "whales.inc"
  ],
  "schemaVersion": "1.0.0",
  "standardIncludes": [
    "BR_conditions.inc",
    "EnlargeMap.inc",
    "externalterrainpatch.inc",
    "F_Animals.inc",
    "F_ColorCorrection.inc",
    "F_Distances_A.inc",
    "F_Distances_B.inc",
    "F_Distances_B2.inc",
    "F_Distances_C23.inc",
    "F_Distances_C30.inc",
    "F_Distances_D23.inc",
    "F_Distances_D30.inc",
    "F_Distances_E23.inc",
    "F_FarGoldStone.inc",
    "F_Kericek.inc",
    "F_NearGoldStone.inc",
    "F_Relics.inc",
    "F_ResByMap.inc",
    "F_seasons.inc",
    "F_StartingVills.inc",
    "F_WaterMasking.inc",
    "GeneratingElevation.inc",
    "GeneratingObjects.inc",
    "includes/aquatic_freshwater.inc",
    "includes/aquatic_saltwater.inc",
    "includes/birds.inc",
    "includes/capture_relic.inc",
    "includes/cliffs.inc",
    "includes/coastal_blending.inc",
    "includes/colour.inc",
    "includes/constants.inc",
    "includes/decay.inc",
    "includes/empire_buildings.inc",
    "includes/empire_food.inc",
    "includes/empire_gold.inc",
    "includes/empire_wars.inc",
    "includes/empire_wood.inc",
    "includes/escalation_mode.inc",
    "includes/forest.inc",
    "includes/furbearers.inc",
    "includes/gaia_civilisation.inc",
    "includes/helpers.inc",
    "includes/herdable.inc",
    "includes/herdable_starting.inc",
    "includes/huntable.inc",
    "includes/islands.inc",
    "includes/lureable.inc",
    "includes/mainland.inc",
    "includes/market_lands.inc",
    "includes/market_objects.inc",
    "includes/market_terrain.inc",
    "includes/neritic.inc",
    "includes/object_groups.inc",
    "includes/object_setup.inc",
    "includes/oysters.inc",
    "includes/predators.inc",
    "includes/preliminaries.inc",
    "includes/reeds.inc",
    "includes/regicide.inc",
    "includes/relics.inc",
    "includes/remote_resources.inc",
    "includes/riparian.inc",
    "includes/scaling.inc",
    "includes/scouts.inc",
    "includes/starting_objects.inc",
    "includes/starting_resources.inc",
    "includes/stragglers.inc",
    "includes/stragglers_coastal.inc",
    "includes/stragglers_neutral.inc",
    "includes/themes.inc",
    "includes/town_centres.inc",
    "includes/town_herdable.inc",
    "includes/villagers.inc",
    "includes/walls.inc",
    "includes/water_blending.inc",
    "includes/water_preset.inc",
    "includes/whales.inc",
    "land_and_water_resources.inc",
    "land_resources.inc",
    "std_resources.inc",
    "thebr_setup.inc"
  ]
}
